{
  "eventId": "40111111-1111-4111-8111-111111111111",
  "eventType": "evidence.validation-completed",
  "schemaVersion": 1,
  "tenantId": "tenant-byd",
  "correlationId": "corr-m39",
  "causationId": "40222222-2222-4222-8222-222222222222",
  "aggregateType": "EvidenceRevision",
  "aggregateId": "40333333-3333-4333-8333-333333333333",
  "aggregateVersion": 3,
  "occurredAt": "2026-07-14T09:05:00Z",
  "payload": {
    "evidenceRevisionId": "40333333-3333-4333-8333-333333333333",
    "evidenceItemId": "40444444-4444-4444-8444-444444444444",
    "evidenceSlotId": "40555555-5555-4555-8555-555555555555",
    "taskId": "88888888-8888-4888-8888-888888888888",
    "projectId": "33333333-3333-4333-8333-333333333333",
    "status": "VALIDATED",
    "blockedFailureCount": 0,
    "warningCount": 0,
    "completedAt": "2026-07-14T09:05:00Z"
  }
}
